Chunk ID,Filename,Tokens,Text
ten_questions_about_human_error_5.docx_0,ten_questions_about_human_error_5.docx,359,title questions human view human factors system safety chapter author sidney category analysis human...
ten_questions_about_human_error_5.docx_1,ten_questions_about_human_error_5.docx,374,kind subtractive model awareness diagram notation also express equation reflect large circle small c...
ten_questions_about_human_error_5.docx_2,ten_questions_about_human_error_5.docx,380,gitan matter something something dependent mind observer something open enter awareness anyone auton...
ten_questions_about_human_error_5.docx_3,ten_questions_about_human_error_5.docx,405,situation point view mismatch grow people think easily draw circle diagram pointing deficiency short...
ten_questions_about_human_error_5.docx_4,ten_questions_about_human_error_5.docx,395,remember taxiway sign suppose leave side taxiway belong fact little time pilot training use pilot le...
ten_questions_about_human_error_5.docx_5,ten_questions_about_human_error_5.docx,377,appeal mental processing image invert also dimensional cast back reconcile single coherent upright p...
ten_questions_about_human_error_5.docx_6,ten_questions_about_human_error_5.docx,396,version still use psychological method debate today although empirical method develop around psychol...
ten_questions_about_human_error_5.docx_7,ten_questions_about_human_error_5.docx,378,situation claim natural science approach stay intro spec rely objective performance indicator instea...
ten_questions_about_human_error_5.docx_8,ten_questions_about_human_error_5.docx,386,emotion behaviorism thus fundamentally derive general law think applicable across people setting hum...
ten_questions_about_human_error_5.docx_9,ten_questions_about_human_error_5.docx,390,stimulus combine thing already store mind example feature face couple long term memory recognize fac...
ten_questions_about_human_error_5.docx_10,ten_questions_about_human_error_5.docx,385,reduce primary sensation primitive element perceive element perceive meaning meaning come effortless...
ten_questions_about_human_error_5.docx_11,ten_questions_about_human_error_5.docx,372,qualitative method ethnography increasingly legitimate critical understanding distribute cognitive s...
ten_questions_about_human_error_5.docx_12,ten_questions_about_human_error_5.docx,378,environmental status take legitimate input human processing system instead activitie individual part...
ten_questions_about_human_error_5.docx_13,ten_questions_about_human_error_5.docx,398,amplifying exaggerate importance question people know important question make situation must crew qu...
ten_questions_about_human_error_5.docx_14,ten_questions_about_human_error_5.docx,441,ship latitude longitude sixth size number difference size character position indication switch size ...
ten_questions_about_human_error_5.docx_15,ten_questions_about_human_error_5.docx,405,worth management exposition normally select crew year vessel service ship deviate course preset limi...
ten_questions_about_human_error_5.docx_16,ten_questions_about_human_error_5.docx,379,toward journey appear large number cue could potentially reveal true nature situation inability firs...
ten_questions_about_human_error_5.docx_17,ten_questions_about_human_error_5.docx,391,accident investigation conclude discover portuguese fishing vessel try royal majesty radio warn immi...
ten_questions_about_human_error_5.docx_18,ten_questions_about_human_error_5.docx,180,opportunity avoid ground repeat invitation undergo kind epiphany real nature situation never experie...
ten_questions_about_human_error_8.docx_0,ten_questions_about_human_error_8.docx,374,title questions human view human factors system safety chapter author sidney category analysis human...
ten_questions_about_human_error_8.docx_1,ten_questions_about_human_error_8.docx,372,agreement underlie mechanism precise definition people long dare label mean lest other suspect reall...
ten_questions_about_human_error_8.docx_2,ten_questions_about_human_error_8.docx,377,repetitive stimulus vigilance decrement form interesting research problem since birth human factor s...
ten_questions_about_human_error_8.docx_3,ten_questions_about_human_error_8.docx,359,assumption satisfactory system state justify unjustified make assumption unjustified know would make...
ten_questions_about_human_error_8.docx_4,ten_questions_about_human_error_8.docx,350,awareness make leap leave trace other follow critique current theory situation awareness sufficientl...
ten_questions_about_human_error_8.docx_5,ten_questions_about_human_error_8.docx,384,falsify tribute generalization famous example generalization psychology invert curve also know yerke...
ten_questions_about_human_error_8.docx_6,ten_questions_about_human_error_8.docx,396,pilot deviation basic operational procedure primary factor almost accident utman galli methodologica...
ten_questions_about_human_error_8.docx_7,ten_questions_about_human_error_8.docx,374,demonstrate willing work around difficulty without reference design authority include situation comp...
ten_questions_about_human_error_8.docx_8,ten_questions_about_human_error_8.docx,363,rule instead typically impose mechanistic static view good practice procedure follow also antithetic...
ten_questions_about_human_error_8.docx_9,ten_questions_about_human_error_8.docx,389,hour accomplish entirely clear testimony whether include removal access panel estimate ask whether h...
ten_questions_about_human_error_8.docx_10,ten_questions_about_human_error_8.docx,366,procedure safety procedure resource action procedure specify circumstance apply procedure dictate ap...
ten_questions_about_human_error_8.docx_11,ten_questions_about_human_error_8.docx,384,aforementioned case merely stress importance follow procedure increase number case people fail adapt...
ten_questions_about_human_error_8.docx_12,ten_questions_about_human_error_8.docx,362,operator share bridge inspector partner joint effort toward progress safety latter role develop fait...
ten_questions_about_human_error_8.docx_13,ten_questions_about_human_error_8.docx,389,dilemma would weather major airport dispatcher airplane route safety making craft divert widely arou...
ten_questions_about_human_error_8.docx_14,ten_questions_about_human_error_8.docx,385,become routinized part vast informal network characterize much maintenance work include informal hie...
ten_questions_about_human_error_8.docx_15,ten_questions_about_human_error_8.docx,379,goal conflict individual crew operator describe model question dynamic macro micro connection chapte...
ten_questions_about_human_error_8.docx_16,ten_questions_about_human_error_8.docx,377,never explicit acknowledge understand value similar british army somme management maintenance organi...
ten_questions_about_human_error_8.docx_17,ten_questions_about_human_error_8.docx,388,local way accommodate multiple goal important organization maximize capacity utilization safely meet...
ten_questions_about_human_error_8.docx_18,ten_questions_about_human_error_8.docx,391,early concept automate much possible consider appropriate would lead great safety great capability b...
ten_questions_about_human_error_8.docx_19,ten_questions_about_human_error_8.docx,419,interesting operator fact highly confusing rather operator must forest seemingly disconnect failure ...
ten_questions_about_human_error_8.docx_20,ten_questions_about_human_error_8.docx,386,brittle procedure follow operator follow heuristic cue automation rather actively seek deal informat...
ten_questions_about_human_error_8.docx_21,ten_questions_about_human_error_8.docx,392,highly dependent many factor include people experience goal history direct attention allude early pe...
ten_questions_about_human_error_8.docx_22,ten_questions_about_human_error_8.docx,397,pilot track mode automate cockpit formal instrument tracking check mode change status flight mode sm...
ten_questions_about_human_error_8.docx_23,ten_questions_about_human_error_8.docx,403,awareness dominant relevant design really ture crew attention automation status behavior radically w...
ten_questions_about_human_error_8.docx_24,ten_questions_about_human_error_8.docx,409,determine language attribute back result human center system typically heuristic adaptive human abil...
ten_questions_about_human_error_8.docx_25,ten_questions_about_human_error_8.docx,414,adapt rather people practice get transform turn adapt technology local demand constraint accept auto...
ten_questions_about_human_error_8.docx_26,ten_questions_about_human_error_8.docx,382,study direct routing allow aircraft deviation without negotiation freedom action grant individual ai...
ten_questions_about_human_error_8.docx_27,ten_questions_about_human_error_8.docx,377,plurality kind parochialism people mistake partial narrow view dominant view future practice unaware...
ten_questions_about_human_error_8.docx_28,ten_questions_about_human_error_8.docx,358,anomaly process exception point view supervisor controller exceptions arise case airspace participan...
why_accidents_happen_critical_review_accident_causation_models.docx_0,why_accidents_happen_critical_review_accident_causation_models.docx,384,title chapter accidents happen critical review evolution construction accident causation models auth...
why_accidents_happen_critical_review_accident_causation_models.docx_1,why_accidents_happen_critical_review_accident_causation_models.docx,398,wide help share building knowledge blink technology help build fast complicate whole construction pr...
why_accidents_happen_critical_review_accident_causation_models.docx_2,why_accidents_happen_critical_review_accident_causation_models.docx,382,surround incident fail include unsafe condition also systemic organizational cause furthermore misgu...
why_accidents_happen_critical_review_accident_causation_models.docx_3,why_accidents_happen_critical_review_accident_causation_models.docx,59,accidents happen failure factor nevertheless take close development accident causation model year in...
aviat_eco_sys_do178c_arp4754_do254_10.docx_0,aviat_eco_sys_do178c_arp4754_do254_10.docx,386,title aviation development ecosystem apply related guidelines chapter author vance industry experts ...
aviat_eco_sys_do178c_arp4754_do254_10.docx_1,aviat_eco_sys_do178c_arp4754_do254_10.docx,413,incumbent user elucidate additional standard criterion specific process provide recommend standard o...
aviat_eco_sys_do178c_arp4754_do254_10.docx_2,aviat_eco_sys_do178c_arp4754_do254_10.docx,404,regulatory authority usually responsible quality compliance defective degrade element lose misplaced...
aviat_eco_sys_do178c_arp4754_do254_10.docx_3,aviat_eco_sys_do178c_arp4754_do254_10.docx,390,system provably quality management system suffice minor upgrade hundred article many book exist comm...
aviat_eco_sys_do178c_arp4754_do254_10.docx_4,aviat_eco_sys_do178c_arp4754_do254_10.docx,17,extraction typically every day retain every day execution extraction must aeronautical quality attri...
aviat_eco_sys_do178c_arp4754_do254_11.docx_0,aviat_eco_sys_do178c_arp4754_do254_11.docx,373,title aviation development ecosystem apply related guidelines chapter author vance industry experts ...
aviat_eco_sys_do178c_arp4754_do254_11.docx_1,aviat_eco_sys_do178c_arp4754_do254_11.docx,385,gloss subtle difference result significant misunderstanding mistake apply information describe begin...
aviat_eco_sys_do178c_arp4754_do254_11.docx_2,aviat_eco_sys_do178c_arp4754_do254_11.docx,390,must apply approximately similar many important difference exist assurance require requirement assur...
aviat_eco_sys_do178c_arp4754_do254_11.docx_3,aviat_eco_sys_do178c_arp4754_do254_11.docx,383,mandatory within communication navigation surveillance traffic management certification authority wa...
aviat_eco_sys_do178c_arp4754_do254_11.docx_4,aviat_eco_sys_do178c_arp4754_do254_11.docx,382,concern software design implement rather fulfil intend function follow system engineering process as...
aviat_eco_sys_do178c_arp4754_do254_11.docx_5,aviat_eco_sys_do178c_arp4754_do254_11.docx,185,system graphic library board support packages however communication navigation surveillance traffic ...
aviat_eco_sys_do178c_arp4754_do254_12.docx_0,aviat_eco_sys_do178c_arp4754_do254_12.docx,392,title aviation development ecosystem apply related guidelines chapter author vance industry experts ...
aviat_eco_sys_do178c_arp4754_do254_12.docx_1,aviat_eco_sys_do178c_arp4754_do254_12.docx,387,usage model imply develop model structure behavior prior use model generate actual software hardware...
aviat_eco_sys_do178c_arp4754_do254_12.docx_2,aviat_eco_sys_do178c_arp4754_do254_12.docx,413,standard model requirement model configuration item model element library model system interface mod...
aviat_eco_sys_do178c_arp4754_do254_12.docx_3,aviat_eco_sys_do178c_arp4754_do254_12.docx,392,model specification model could reside within model model exist development specification model prec...
aviat_eco_sys_do178c_arp4754_do254_12.docx_4,aviat_eco_sys_do178c_arp4754_do254_12.docx,245,verify entire system model formal method ostensibly allow supplement commonly apply however best pra...
aviat_eco_sys_do178c_arp4754_do254_14.docx_0,aviat_eco_sys_do178c_arp4754_do254_14.docx,402,title aviation development ecosystem apply related guidelines chapter author vance industry experts ...
aviat_eco_sys_do178c_arp4754_do254_14.docx_1,aviat_eco_sys_do178c_arp4754_do254_14.docx,384,technology occur simple reason object orient technology increasingly embody economic advantage funct...
aviat_eco_sys_do178c_arp4754_do254_14.docx_2,aviat_eco_sys_do178c_arp4754_do254_14.docx,412,complexity management commercial consumer financial sector go much rethink entire premise programmin...
aviat_eco_sys_do178c_arp4754_do254_14.docx_3,aviat_eco_sys_do178c_arp4754_do254_14.docx,403,orient technology usage possess vulnerabilitie project must consider software development environmen...
aviat_eco_sys_do178c_arp4754_do254_14.docx_4,aviat_eco_sys_do178c_arp4754_do254_14.docx,404,ensue equivalence class nested template friend class prohibit level ensure control coupling address ...
aviat_eco_sys_do178c_arp4754_do254_14.docx_5,aviat_eco_sys_do178c_arp4754_do254_14.docx,407,fail checker tool play role avionic engineer available ready commercial shelf cots software purchase...
aviat_eco_sys_do178c_arp4754_do254_14.docx_6,aviat_eco_sys_do178c_arp4754_do254_14.docx,422,possible certification authority address certification planning document assessment evaluation perfo...
aviat_eco_sys_do178c_arp4754_do254_14.docx_7,aviat_eco_sys_do178c_arp4754_do254_14.docx,402,applicable objective life cycle fiction execute life cycle process planning process requirement proc...
aviat_eco_sys_do178c_arp4754_do254_14.docx_8,aviat_eco_sys_do178c_arp4754_do254_14.docx,419,ability relationship must develop assess various qualification requirement base upon fiction credit ...
aviat_eco_sys_do178c_arp4754_do254_14.docx_9,aviat_eco_sys_do178c_arp4754_do254_14.docx,251,integration criterion include trace ability affirm audit important require simple qualified must und...
aviat_eco_sys_do178c_arp4754_do254_15.docx_0,aviat_eco_sys_do178c_arp4754_do254_15.docx,349,title aviation development ecosystem apply related guidelines chapter author vance industry experts ...
aviat_eco_sys_do178c_arp4754_do254_15.docx_1,aviat_eco_sys_do178c_arp4754_do254_15.docx,381,recommendation guidance recommendation efficiently honest answer question find cyber threat cyber se...
aviat_eco_sys_do178c_arp4754_do254_15.docx_2,aviat_eco_sys_do178c_arp4754_do254_15.docx,351,enable least partial degraded operation attack tool back system could restore corrupt type security ...
aviat_eco_sys_do178c_arp4754_do254_15.docx_3,aviat_eco_sys_do178c_arp4754_do254_15.docx,393,lets shall start play eica message oxygen anyone fortunately roberts white hacker immediate damage w...
aviat_eco_sys_do178c_arp4754_do254_15.docx_4,aviat_eco_sys_do178c_arp4754_do254_15.docx,398,start work industrial automation control systems security standard baseline nist guide industrial co...
aviat_eco_sys_do178c_arp4754_do254_15.docx_5,aviat_eco_sys_do178c_arp4754_do254_15.docx,368,state first series document aeronautical systems security together address information security over...
aviat_eco_sys_do178c_arp4754_do254_15.docx_6,aviat_eco_sys_do178c_arp4754_do254_15.docx,373,like member series additionally apply holistic approach publish document without equivalent aeronaut...
aviat_eco_sys_do178c_arp4754_do254_15.docx_7,aviat_eco_sys_do178c_arp4754_do254_15.docx,385,rules risk management within organization service provider horizontal guidance designating schedule ...
aviat_eco_sys_do178c_arp4754_do254_15.docx_8,aviat_eco_sys_do178c_arp4754_do254_15.docx,391,aircraft components handle aircraft network access points ground support equipment ground support in...
aviat_eco_sys_do178c_arp4754_do254_15.docx_9,aviat_eco_sys_do178c_arp4754_do254_15.docx,376,assurance level would mean assurance effort would relaxed system item rate risk assessment security ...
aviat_eco_sys_do178c_arp4754_do254_2.docx_0,aviat_eco_sys_do178c_arp4754_do254_2.docx,387,title aviation development ecosystem apply related guidelines chapter author vance industry experts ...
aviat_eco_sys_do178c_arp4754_do254_2.docx_1,aviat_eco_sys_do178c_arp4754_do254_2.docx,360,difference way learn indeed impossible thing thing people reader find knowledge garner helpful resul...
aviat_eco_sys_do178c_arp4754_do254_2.docx_2,aviat_eco_sys_do178c_arp4754_do254_2.docx,356,define protocol aviation safety whereas worldwide protocol exist manmade endeavor include peacekeepi...
aviat_eco_sys_do178c_arp4754_do254_2.docx_3,aviat_eco_sys_do178c_arp4754_do254_2.docx,364,process standard airspace communication aircraft system component important represent different view...
aviat_eco_sys_do178c_arp4754_do254_2.docx_4,aviat_eco_sys_do178c_arp4754_do254_2.docx,307,avionic development certification excessive economy scale really possible industry successful projec...
aviat_eco_sys_do178c_arp4754_do254_3.docx_0,aviat_eco_sys_do178c_arp4754_do254_3.docx,386,title aviation development ecosystem apply related guidelines chapter author vance industry experts ...
aviat_eco_sys_do178c_arp4754_do254_3.docx_1,aviat_eco_sys_do178c_arp4754_do254_3.docx,376,aircraft relative wear deterioration example skin corrosion window lamination craze fluid leak tire ...
aviat_eco_sys_do178c_arp4754_do254_3.docx_2,aviat_eco_sys_do178c_arp4754_do254_3.docx,369,type certificate certification plan detail follow information approve certification authority prior ...
aviat_eco_sys_do178c_arp4754_do254_3.docx_3,aviat_eco_sys_do178c_arp4754_do254_3.docx,390,certification complete note exception usually preclude situation applicant would change design unfor...
aviat_eco_sys_do178c_arp4754_do254_3.docx_4,aviat_eco_sys_do178c_arp4754_do254_3.docx,363,certificate typical vehicle avionic system appliance instal aircraft current active type certificate...
aviat_eco_sys_do178c_arp4754_do254_3.docx_5,aviat_eco_sys_do178c_arp4754_do254_3.docx,411,certification compliance package complete submit regulatory authority final processing supplemental ...
aviat_eco_sys_do178c_arp4754_do254_3.docx_6,aviat_eco_sys_do178c_arp4754_do254_3.docx,411,obviate prior version technical standard order update technical standard order clearly state whether...
aviat_eco_sys_do178c_arp4754_do254_3.docx_7,aviat_eco_sys_do178c_arp4754_do254_3.docx,377,approval approval applicable specific device specific process procedure device manufacturer hold par...
aviat_eco_sys_do178c_arp4754_do254_3.docx_8,aviat_eco_sys_do178c_arp4754_do254_3.docx,228,obtain actual production approval part step necessary design already show safe standard regulation s...
aviat_eco_sys_do178c_arp4754_do254_4.docx_0,aviat_eco_sys_do178c_arp4754_do254_4.docx,349,title aviation development ecosystem apply related guidelines chapter author vance industry experts ...
aviat_eco_sys_do178c_arp4754_do254_4.docx_1,aviat_eco_sys_do178c_arp4754_do254_4.docx,362,aviation safety aircraft avionic new version provide foundation literally every aspect aviation unde...
aviat_eco_sys_do178c_arp4754_do254_4.docx_2,aviat_eco_sys_do178c_arp4754_do254_4.docx,381,advisory circular system design analysis federal aviation administration advisory circular certifica...
aviat_eco_sys_do178c_arp4754_do254_4.docx_3,aviat_eco_sys_do178c_arp4754_do254_4.docx,380,believe commonly accept definition assessment evaluation base upon engineering judgment average prob...
aviat_eco_sys_do178c_arp4754_do254_4.docx_4,aviat_eco_sys_do178c_arp4754_do254_4.docx,369,safety assessment goal eradicate potential hazard lofty impossible complex asynchronous avionic syst...
aviat_eco_sys_do178c_arp4754_do254_4.docx_5,aviat_eco_sys_do178c_arp4754_do254_4.docx,351,aircraft functional hazard assessment failure condition parent child relationship system functional ...
aviat_eco_sys_do178c_arp4754_do254_4.docx_6,aviat_eco_sys_do178c_arp4754_do254_4.docx,379,conjunction ensure developer apply formal iteration process safety whereby safety continually addres...
aviat_eco_sys_do178c_arp4754_do254_4.docx_7,aviat_eco_sys_do178c_arp4754_do254_4.docx,362,redundancy consideration specification annunciation failure condition propose pilot crew mitigation ...
aviat_eco_sys_do178c_arp4754_do254_4.docx_8,aviat_eco_sys_do178c_arp4754_do254_4.docx,373,detail procedure follow event certain failure condition information show system item develop accorda...
aviat_eco_sys_do178c_arp4754_do254_4.docx_9,aviat_eco_sys_do178c_arp4754_do254_4.docx,391,failure software perform intend function software failure condition category similar hardware failur...
aviat_eco_sys_do178c_arp4754_do254_4.docx_10,aviat_eco_sys_do178c_arp4754_do254_4.docx,176,short term benefit tool auto generation certification documentation standardize taxonomy safety veri...
aviat_eco_sys_do178c_arp4754_do254_5.docx_0,aviat_eco_sys_do178c_arp4754_do254_5.docx,361,title aviation development ecosystem apply related guidelines chapter author vance industry experts ...
aviat_eco_sys_do178c_arp4754_do254_5.docx_1,aviat_eco_sys_do178c_arp4754_do254_5.docx,391,certification organization worldwide increasingly formally mandate adherence late version experience...
aviat_eco_sys_do178c_arp4754_do254_5.docx_2,aviat_eco_sys_do178c_arp4754_do254_5.docx,360,functionality identify increasingly refined inception aircraft system safety process refine concept ...
aviat_eco_sys_do178c_arp4754_do254_5.docx_3,aviat_eco_sys_do178c_arp4754_do254_5.docx,406,vision aircraft safety design guide system development guide manual integrate safety assessment regi...
aviat_eco_sys_do178c_arp4754_do254_5.docx_4,aviat_eco_sys_do178c_arp4754_do254_5.docx,389,activity follow process plan certification define certification achieve plan detail place within doc...
aviat_eco_sys_do178c_arp4754_do254_5.docx_5,aviat_eco_sys_do178c_arp4754_do254_5.docx,366,hazard assessment objective functional hazard assessment identify function failure condition functio...
aviat_eco_sys_do178c_arp4754_do254_5.docx_6,aviat_eco_sys_do178c_arp4754_do254_5.docx,383,cause analysis correspond safety assessment chapter development assurance assignment conjunction saf...
aviat_eco_sys_do178c_arp4754_do254_5.docx_7,aviat_eco_sys_do178c_arp4754_do254_5.docx,359,partly satisfy safety determine development assurance process determination development assurance pr...
aviat_eco_sys_do178c_arp4754_do254_5.docx_8,aviat_eco_sys_do178c_arp4754_do254_5.docx,371,often relate directly safety closing definition functionality require developer ensure existence fee...
aviat_eco_sys_do178c_arp4754_do254_5.docx_9,aviat_eco_sys_do178c_arp4754_do254_5.docx,383,detection commonly believe verification perform purely identify error fix partially true verificatio...
aviat_eco_sys_do178c_arp4754_do254_5.docx_10,aviat_eco_sys_do178c_arp4754_do254_5.docx,137,audits do process assurance use process assurance checklist configuration management process assuran...
aviat_eco_sys_do178c_arp4754_do254_6.docx_0,aviat_eco_sys_do178c_arp4754_do254_6.docx,385,title aviation development ecosystem apply related guidelines chapter author vance industry experts ...
aviat_eco_sys_do178c_arp4754_do254_6.docx_1,aviat_eco_sys_do178c_arp4754_do254_6.docx,364,avionic certification strategy make could address federal aviation administration advisory circulars...
aviat_eco_sys_do178c_arp4754_do254_6.docx_2,aviat_eco_sys_do178c_arp4754_do254_6.docx,389,perfect invariably simple software program answer software weak link consider software perfect obvio...
aviat_eco_sys_do178c_arp4754_do254_6.docx_3,aviat_eco_sys_do178c_arp4754_do254_6.docx,388,avionic couple great software usability mean software development technique particular three technol...
aviat_eco_sys_do178c_arp4754_do254_6.docx_4,aviat_eco_sys_do178c_arp4754_do254_6.docx,35,must difference modifying application must certify platform impact unless world first perfect softwa...
aviat_eco_sys_do178c_arp4754_do254_7.docx_0,aviat_eco_sys_do178c_arp4754_do254_7.docx,378,title aviation development ecosystem apply related guidelines chapter author vance industry experts ...
aviat_eco_sys_do178c_arp4754_do254_7.docx_1,aviat_eco_sys_do178c_arp4754_do254_7.docx,382,elephant ability stably exist guarantee health certainly lessen probability early demise start premi...
aviat_eco_sys_do178c_arp4754_do254_7.docx_2,aviat_eco_sys_do178c_arp4754_do254_7.docx,390,safety assessment process precede application plus application applicable consideration actual opera...
aviat_eco_sys_do178c_arp4754_do254_7.docx_3,aviat_eco_sys_do178c_arp4754_do254_7.docx,390,safety system describe precede chapter software quality assurance plan detail quality assurance obje...
