Chunk ID,Filename,Tokens,Text
commercial_aviation_safety_4.docx_2,commercial_aviation_safety_4.docx,376,possible aviation professional must always remember ethical obligation arrive period work perform go...
commercial_aviation_safety_4.docx_3,commercial_aviation_safety_4.docx,383,discourage bird congregate around airport final analysis risk accident cause bird reduce zero withou...
commercial_aviation_safety_4.docx_4,commercial_aviation_safety_4.docx,378,serious incident unsafe event instead opt complacency thus allow accident chain propagate crew resou...
commercial_aviation_safety_4.docx_5,commercial_aviation_safety_4.docx,388,aviation help visualize flight operation look like october american airways fly fokker motor west ha...
commercial_aviation_safety_4.docx_6,commercial_aviation_safety_4.docx,378,straw break camel back douglas operate united airlines flight crash near portland oregon run fuel ki...
commercial_aviation_safety_4.docx_7,commercial_aviation_safety_4.docx,377,resource management skill skill work together assure safe outcome flight four carrier united states ...
commercial_aviation_safety_4.docx_8,commercial_aviation_safety_4.docx,384,threats condition make task complicated rain ramp operation fatigue overnight maintenance external i...
commercial_aviation_safety_4.docx_9,commercial_aviation_safety_4.docx,355,specifically assign task many challenge face intro tion cockpit resource management change someone l...
commercial_aviation_safety_4.docx_10,commercial_aviation_safety_4.docx,377,responsible final authority operation aircraft code federal regulation state flight opera ion comman...
commercial_aviation_safety_4.docx_11,commercial_aviation_safety_4.docx,380,operate aircraft begin cockpit resource management movement flight training instructor curriculum de...
commercial_aviation_safety_4.docx_12,commercial_aviation_safety_4.docx,373,study component start foundation leadership follower since interplay stage everything follow inside ...
commercial_aviation_safety_4.docx_13,commercial_aviation_safety_4.docx,376,aspect troubleshooting decision make leadership aspect leader must able encourage development leader...
commercial_aviation_safety_4.docx_14,commercial_aviation_safety_4.docx,381,certainly true extent value describe specific action germane follower leadership leader would agree ...
commercial_aviation_safety_4.docx_15,commercial_aviation_safety_4.docx,389,situation since individual vest official authority recognize regulation opera organization cease ind...
commercial_aviation_safety_4.docx_16,commercial_aviation_safety_4.docx,409,sixteen hundred indicate coordinated universal time pilot dispatcher would know precisely time refer...
commercial_aviation_safety_4.docx_17,commercial_aviation_safety_4.docx,387,month duty schedule traffic controller issue traffic first officer regard light aircraft first offic...
commercial_aviation_safety_4.docx_18,commercial_aviation_safety_4.docx,374,sometimes call briefing take place start every every crew pair accomplish different time prior comme...
commercial_aviation_safety_4.docx_19,commercial_aviation_safety_4.docx,396,attendant ensure ready receive briefing proceed brief stress moment flight attendant stress already ...
commercial_aviation_safety_4.docx_20,commercial_aviation_safety_4.docx,383,run cabin evacuation scale cabin mock learn situation thus understand concern possible thought give ...
commercial_aviation_safety_4.docx_21,commercial_aviation_safety_4.docx,380,aeronautical decision make product cockpit resource management lead explain mental systematic approa...
commercial_aviation_safety_4.docx_22,commercial_aviation_safety_4.docx,372,homage rich heritage adventure technical prowess stem back century pilot profession long value resol...
commercial_aviation_safety_4.docx_23,commercial_aviation_safety_4.docx,393,troubleshooting task crew also coordinate closely flight attendant passenger particularly give passe...
commercial_aviation_safety_4.docx_24,commercial_aviation_safety_4.docx,384,aisle demo second command stop push driver stop want continue bump aircraft realize direct return ga...
commercial_aviation_safety_4.docx_25,commercial_aviation_safety_4.docx,291,cockpit resource management relate notion threat management stand good practice team member work tog...
commercial_aviation_safety_5.docx_0,commercial_aviation_safety_5.docx,369,title commercial aviation safety chapter author stephen cusick antonio cortes clarence rodrigues cat...
commercial_aviation_safety_5.docx_1,commercial_aviation_safety_5.docx,396,plan gasp outline safety activity navigation capacity efficiency increase capacity sky improve globa...
commercial_aviation_safety_5.docx_2,commercial_aviation_safety_5.docx,393,council secretariat chief officer international civil aviation organization president council secret...
commercial_aviation_safety_5.docx_3,commercial_aviation_safety_5.docx,366,recommended practices often amplify basic principle correspond standards recommended practice qualif...
commercial_aviation_safety_5.docx_4,commercial_aviation_safety_5.docx,384,management safety assurance safety promotion however inconsistency maturity state program large stat...
commercial_aviation_safety_5.docx_5,commercial_aviation_safety_5.docx,386,encourage civil aviation abroad activity include exchange aeronautical information foreign authority...
commercial_aviation_safety_5.docx_6,commercial_aviation_safety_5.docx,380,office also responsible national airport planning environmental social require ment establishe polic...
commercial_aviation_safety_5.docx_7,commercial_aviation_safety_5.docx,366,inspection program exist regulatory inspection program local regional structure sufficient flexibili...
commercial_aviation_safety_5.docx_8,commercial_aviation_safety_5.docx,375,federal aviation administration address cert tion priority basis certification request fulfil remain...
commercial_aviation_safety_5.docx_9,commercial_aviation_safety_5.docx,372,dual mandate commercial space operations federal aviation administration establish jurisdiction rule...
commercial_aviation_safety_5.docx_10,commercial_aviation_safety_5.docx,381,pilot receive certain academic coursework federal aviation administration publish public public comm...
commercial_aviation_safety_5.docx_11,commercial_aviation_safety_5.docx,380,unlike requirement previously discuss foundation part root science extensive research conduct examin...
commercial_aviation_safety_5.docx_12,commercial_aviation_safety_5.docx,368,many thousand life reduce occupational injury illness rate half although highlight major development...
commercial_aviation_safety_5.docx_13,commercial_aviation_safety_5.docx,382,pollution systematically integrate variety research monitor standard set enforce ment activity compl...
commercial_aviation_safety_5.docx_14,commercial_aviation_safety_5.docx,379,boston region york region philadelphia region atlanta region chicago region dallas region kansas cit...
commercial_aviation_safety_5.docx_15,commercial_aviation_safety_5.docx,360,cleaning aircraft generate paint waste phenol organic solvent acid alkali plating strip rust prevent...
commercial_aviation_safety_5.docx_16,commercial_aviation_safety_5.docx,388,relate aviation year come noise control past coordinate federal noise control activity office noise ...
commercial_aviation_safety_5.docx_17,commercial_aviation_safety_5.docx,379,review pilot generally agree quality crew accommodation erode line pair get difficult rest almost im...
commercial_aviation_safety_5.docx_18,commercial_aviation_safety_5.docx,36,inspector workload affect since airline deregulation difficult attract inspector major metropolitan ...
commercial_aviation_safety_6.docx_0,commercial_aviation_safety_6.docx,369,title commercial aviation safety chapter author stephen cusick antonio cortes clarence rodrigues cat...
commercial_aviation_safety_6.docx_1,commercial_aviation_safety_6.docx,379,examine human interact aircraft system ent flight deck automation finding accident investigation fin...
commercial_aviation_safety_6.docx_2,commercial_aviation_safety_6.docx,356,inspection hydraulic valve brake system document actually accomplish accident investigator wisely de...
commercial_aviation_safety_6.docx_3,commercial_aviation_safety_6.docx,358,regulator implement change develop put regulation practice resource intensive require time money car...
commercial_aviation_safety_6.docx_4,commercial_aviation_safety_6.docx,340,transportation safety board assign accredited representative assist investigation outpoure effort in...
commercial_aviation_safety_6.docx_5,commercial_aviation_safety_6.docx,342,determination cause accident along comprehensive consider safety recommendation visible portion nati...
commercial_aviation_safety_6.docx_6,commercial_aviation_safety_6.docx,363,president confirm senate serve year term chairman vice chairman designate five board national transp...
commercial_aviation_safety_6.docx_7,commercial_aviation_safety_6.docx,359,accident participate foreign accident investigation responsibility authority supervise coordinate re...
commercial_aviation_safety_6.docx_8,commercial_aviation_safety_6.docx,381,leak hydraulic fluid could sink ground subtle clue lose could reveal possible factor accident conseq...
commercial_aviation_safety_6.docx_9,commercial_aviation_safety_6.docx,380,record specialist examine factor involve flight operation carrier airport flight training experience...
commercial_aviation_safety_6.docx_10,commercial_aviation_safety_6.docx,378,safety board group chair senior investigator see specific investigation complete factual report resp...
commercial_aviation_safety_6.docx_11,commercial_aviation_safety_6.docx,357,ion find probable cause follow period review draft report public meeting board member hold washingto...
commercial_aviation_safety_6.docx_12,commercial_aviation_safety_6.docx,345,single accident profound effect commercial aviation safety today investigate general aviation accide...
commercial_aviation_safety_6.docx_13,commercial_aviation_safety_6.docx,354,tiga tion complete include authority procure service federal aviation administration personnel facil...
commercial_aviation_safety_6.docx_14,commercial_aviation_safety_6.docx,371,preserve survivable space ensure evacuation expand recorders enhance transportation safety investiga...
commercial_aviation_safety_6.docx_15,commercial_aviation_safety_6.docx,378,october federal aviation administration ban travel samsung galaxy note risk phone pose onboard fire ...
commercial_aviation_safety_6.docx_16,commercial_aviation_safety_6.docx,385,discipline pilot make effort collaborate seem love fly happy also important investigator create time...
commercial_aviation_safety_6.docx_17,commercial_aviation_safety_6.docx,385,pratt whitney spanair team highly skilled professional investigator able conduct several engineering...
commercial_aviation_safety_6.docx_18,commercial_aviation_safety_6.docx,371,flap slat indicating light execute start checklist checking flap slat takeoff briefing taxi checklis...
commercial_aviation_safety_6.docx_19,commercial_aviation_safety_6.docx,364,aviation safety agency clarify whether checklist subject acceptance national authority draft instruc...
commercial_aviation_safety_6.docx_20,commercial_aviation_safety_6.docx,158,cause recommendation accident report complement paint story accident exclude element accident report...
commercial_aviation_safety_7.docx_0,commercial_aviation_safety_7.docx,356,title commercial aviation safety chapter author stephen cusick antonio cortes clarence rodrigues cat...
commercial_aviation_safety_7.docx_1,commercial_aviation_safety_7.docx,381,word analysis although process use method collection similar difference term also additional meaning...
commercial_aviation_safety_7.docx_2,commercial_aviation_safety_7.docx,409,piece technology hardware software widely use gathering processing flight operations quality assuran...
commercial_aviation_safety_7.docx_3,commercial_aviation_safety_7.docx,359,operations quality assurance provide scientific analysis important approach source wikimedia commons...
commercial_aviation_safety_7.docx_4,commercial_aviation_safety_7.docx,364,management information provide aviation safety action program report discipline employee report howe...
commercial_aviation_safety_7.docx_5,commercial_aviation_safety_7.docx,360,party collect process analyze voluntarily submit report memorandum agreement agency august plan oper...
commercial_aviation_safety_7.docx_6,commercial_aviation_safety_7.docx,385,aviation safety reporting system staff include highly experienced aviation professional ground pilot...
commercial_aviation_safety_7.docx_7,commercial_aviation_safety_7.docx,383,airline might choose third party analyst pilot express concern integrity line operations safety audi...
commercial_aviation_safety_7.docx_8,commercial_aviation_safety_7.docx,366,program differ traditional regulatory requirement number way participation voluntary carrier choose ...
commercial_aviation_safety_7.docx_9,commercial_aviation_safety_7.docx,374,program airport surface detection equipment model airspace performance metrics aviation safety repor...
commercial_aviation_safety_7.docx_10,commercial_aviation_safety_7.docx,383,hour work company across united states analyze categorize publish industry grouping call standard in...
commercial_aviation_safety_7.docx_11,commercial_aviation_safety_7.docx,359,issue think part true grasp notion commercial aviation operation direct impact environment federal e...
commercial_aviation_safety_7.docx_12,commercial_aviation_safety_7.docx,348,regulation part deal set limit exhaust emission smoke aircraft engine vent fuel emission atmosphere ...
commercial_aviation_safety_7.docx_13,commercial_aviation_safety_7.docx,137,safety health administration initiative occupational safety health administration form occupational ...
commercial_aviation_safety_12.docx_0,commercial_aviation_safety_12.docx,379,title commercial aviation safety chapter author stephen cusick antonio cortes clarence rodrigues cat...
commercial_aviation_safety_12.docx_1,commercial_aviation_safety_12.docx,396,aboard united lines aircraft navigational excessive speed could detect york traffic control tower la...
commercial_aviation_safety_12.docx_2,commercial_aviation_safety_12.docx,401,scope textbook discuss highlight general performance base navigation divide major area navigation te...
commercial_aviation_safety_12.docx_3,commercial_aviation_safety_12.docx,395,cost precision approach today runway need dedicated provide precision approach guidance runway use n...
commercial_aviation_safety_12.docx_4,commercial_aviation_safety_12.docx,383,well decision improve time performance next weather accomplish collaboration efficient handle weathe...
commercial_aviation_safety_12.docx_5,commercial_aviation_safety_12.docx,363,substantially reduce vertical separation minimums evolving show great promise fully operational top ...
commercial_aviation_safety_12.docx_6,commercial_aviation_safety_12.docx,387,within previous month approve federal aviation administration part online training course satisfy re...
commercial_aviation_safety_12.docx_7,commercial_aviation_safety_12.docx,393,deadly accident brazilian aviation history occur many say complex scenario investigate nation histor...
commercial_aviation_safety_12.docx_8,commercial_aviation_safety_12.docx,390,airspace essential responsibility addition accident illustrate accident multi causal instance contro...
commercial_aviation_safety_12.docx_9,commercial_aviation_safety_12.docx,391,influence fatality rate safety indicator able safety factor probability death injury result travel g...
commercial_aviation_safety_12.docx_10,commercial_aviation_safety_12.docx,372,international civil aviation organization icao classifie accident major serious injury damage defini...
commercial_aviation_safety_12.docx_11,commercial_aviation_safety_12.docx,355,consolidation bankruptcy rapidly change aviation landscape aviation industry today different year de...
commercial_aviation_safety_12.docx_12,commercial_aviation_safety_12.docx,398,investigator examine evidence accident site party conduct suggest finding final analysis publish rep...
commercial_aviation_safety_12.docx_13,commercial_aviation_safety_12.docx,387,summary accord boeing accident statistical summary year plus world wide history schedule commercial ...
commercial_aviation_safety_12.docx_14,commercial_aviation_safety_12.docx,366,action although haus compilation therefore offer partial statistical analysis content still prove hi...
commercial_aviation_safety_12.docx_15,commercial_aviation_safety_12.docx,369,airline commuter category vast majority aviation fatality associate general aviation comparison mari...
commercial_aviation_safety_12.docx_16,commercial_aviation_safety_12.docx,390,nonfatal occupational work relate illness injury united states cooperation occupational safety healt...
commercial_aviation_safety_12.docx_17,commercial_aviation_safety_12.docx,381,measure indicate overall status safety ation individual statistic still helpful determine small aspe...
commercial_aviation_safety_12.docx_18,commercial_aviation_safety_12.docx,364,safety would difficult however since commercial aviation business profit investment safety require p...
commercial_aviation_safety_12.docx_19,commercial_aviation_safety_12.docx,363,factor early aviation safety thinking shift focus organ ional safety view system perspective include...
commercial_aviation_safety_12.docx_20,commercial_aviation_safety_12.docx,370,make committee charter provide recommendation federal aviation administration development ment ation...
commercial_aviation_safety_12.docx_21,commercial_aviation_safety_12.docx,379,information newly adopt amendment annex effective july become fully applicable november structure fo...
commercial_aviation_safety_12.docx_22,commercial_aviation_safety_12.docx,384,management control safe efficient operation tion organization management employee hire train dismiss...
commercial_aviation_safety_12.docx_23,commercial_aviation_safety_12.docx,398,impair severity event could vary aircraft damage injury near total destruction depend variable aircr...
commercial_aviation_safety_12.docx_24,commercial_aviation_safety_12.docx,382,method warning alert prevent damage injury unless human respond correctly safety procedure know admi...
commercial_aviation_safety_12.docx_25,commercial_aviation_safety_12.docx,370,submit write statement describe fact circumstance addition provision make immediately conduct interv...
commercial_aviation_safety_12.docx_26,commercial_aviation_safety_12.docx,356,effort direction senior management include corporate safety officer annual emergency response drill ...
commercial_aviation_safety_12.docx_27,commercial_aviation_safety_12.docx,362,factors training group accident analysis accident investigation board line pilots association overse...
commercial_aviation_safety_12.docx_28,commercial_aviation_safety_12.docx,369,safety risk management process perform lever age efficiency gain safety management system combine cr...
commercial_aviation_safety_12.docx_29,commercial_aviation_safety_12.docx,388,safety program oppose simply meet regulatory requirement use represent shift traditional collection ...
commercial_aviation_safety_12.docx_30,commercial_aviation_safety_12.docx,374,agree trade organization investigation accident incident safety relate event conduct punitive fashio...
commercial_aviation_safety_12.docx_31,commercial_aviation_safety_12.docx,394,require response within agree time frame example figure show tech use rotary file modify scallop rin...
commercial_aviation_safety_12.docx_32,commercial_aviation_safety_12.docx,400,training follow teaching pedagogue incorporate follow basic principle attend must understand purpose...
commercial_aviation_safety_12.docx_33,commercial_aviation_safety_12.docx,379,relate safety issue another link relationship forge worthiness concept captain responsible ensure fi...
commercial_aviation_safety_12.docx_34,commercial_aviation_safety_12.docx,391,effectiveness verify complete safety assur ance process include continuous monitoring remain feature...
commercial_aviation_safety_12.docx_35,commercial_aviation_safety_12.docx,364,use phased implementation process thus allow organizational culture adapt evolve concept adopt enlig...
commercial_aviation_safety_12.docx_36,commercial_aviation_safety_12.docx,404,flight several safety cern list relate situation write aircraft logbook fuel system issue prior flig...
commercial_aviation_safety_12.docx_37,commercial_aviation_safety_12.docx,380,concerned captain might ignore status message compliance boeing company procedure take aircraft main...
commercial_aviation_safety_12.docx_38,commercial_aviation_safety_12.docx,126,procedures training risk safety action group safety devices safety management systems safety perform...
commercial_aviation_safety_13.docx_0,commercial_aviation_safety_13.docx,370,title commercial aviation safety chapter author stephen cusick antonio cortes clarence rodrigues cat...
commercial_aviation_safety_13.docx_1,commercial_aviation_safety_13.docx,375,hijacking united states several flight travel caribbean repeatedly detour havana cuba hijacking flig...
commercial_aviation_safety_13.docx_2,commercial_aviation_safety_13.docx,376,passenger france crewmember remain hostage grave risk kill response israel defense forces transport ...
commercial_aviation_safety_13.docx_3,commercial_aviation_safety_13.docx,374,threat along enhanced screen security check facility security security council call strengthen coope...
commercial_aviation_safety_13.docx_4,commercial_aviation_safety_13.docx,372,industry early transportation association seek work single standard security program effort produce ...
commercial_aviation_safety_13.docx_5,commercial_aviation_safety_13.docx,360,certain international threat location instead conduct reconciliation process physically search unacc...
commercial_aviation_safety_13.docx_6,commercial_aviation_safety_13.docx,383,impact tower together heat generate explosion aircraft cause tower collapse third aircraft american ...
commercial_aviation_safety_13.docx_7,commercial_aviation_safety_13.docx,392,number approximately employee conduct passenger screening handle million people multiple layer aviat...
commercial_aviation_safety_13.docx_8,commercial_aviation_safety_13.docx,396,national counter terrorism center establish presidential executive order august order codify intelli...
commercial_aviation_safety_13.docx_9,commercial_aviation_safety_13.docx,391,protection commercial aviation case technology use detect several threat imaging detector search exp...
commercial_aviation_safety_13.docx_10,commercial_aviation_safety_13.docx,375,include detection particulate explosive material skin surface trace explosive material detect must c...
commercial_aviation_safety_13.docx_11,commercial_aviation_safety_13.docx,403,today line check baggage system future extremely efficient able achieve throughput bag hour easy mai...
commercial_aviation_safety_13.docx_12,commercial_aviation_safety_13.docx,373,special number give passenger resolve deny boarding problem prevent future delay misidentifie passen...
commercial_aviation_safety_13.docx_13,commercial_aviation_safety_13.docx,391,weakness threat ensure safe uninterrupted operation replace base traffic control system connect cont...
commercial_aviation_safety_13.docx_14,commercial_aviation_safety_13.docx,395,passenger screening breach security procedures title compromised security result procedural deviatio...
commercial_aviation_safety_13.docx_15,commercial_aviation_safety_13.docx,393,procedure correct look captain aware board plane minute captain deplane continue worth management ex...
commercial_aviation_safety_13.docx_16,commercial_aviation_safety_13.docx,272,require insider collaboration access computerized database badge process landscape aviation technolo...
commercial_aviation_safety_14.docx_0,commercial_aviation_safety_14.docx,381,title commercial aviation safety chapter author stephen cusick antonio cortes clarence rodrigues cat...
commercial_aviation_safety_14.docx_1,commercial_aviation_safety_14.docx,366,provide optimal rather control route flight benefit control would able handle aircraft time reduce d...
commercial_aviation_safety_14.docx_2,commercial_aviation_safety_14.docx,396,within mile airport altitude higher mean obviously operate airspace regularly use commercial aircraf...
commercial_aviation_safety_14.docx_3,commercial_aviation_safety_14.docx,383,computing system federal aviation administration currently design facilitate traffic controller mana...
commercial_aviation_safety_14.docx_4,commercial_aviation_safety_14.docx,383,conflict algorithm hazards could also arise commercial spacecraft experience catastrophic flight bre...
commercial_aviation_safety_14.docx_5,commercial_aviation_safety_14.docx,386,airlines flight indian ocean recent event pull international aviation community together improve air...
commercial_aviation_safety_14.docx_6,commercial_aviation_safety_14.docx,374,wreckage crash ocean wreckage flight recorder essential item accident investigation result safety co...
commercial_aviation_safety_14.docx_7,commercial_aviation_safety_14.docx,386,diversion single attack least mercia airline already jammer mitigate threat although mean widespread...
commercial_aviation_safety_14.docx_8,commercial_aviation_safety_14.docx,381,clean frozen precipitation occur cond ion lead freeze moisture aircraft although hazard pose conditi...
commercial_aviation_safety_14.docx_9,commercial_aviation_safety_14.docx,387,clean frost flight understand critical role ice play aviation important note business analyst predic...
