Chunk ID,Filename,Tokens,Text
icao_doc_9859_safety_management_manual_2.docx_17,icao_doc_9859_safety_management_manual_2.docx,388,manner require regulator skill expertise performance system rather merely prescriptive compliance le...
icao_doc_9859_safety_management_manual_2.docx_18,icao_doc_9859_safety_management_manual_2.docx,367,individual service provider safety management system performance base regulation also demand regulat...
icao_doc_9859_safety_management_manual_2.docx_19,icao_doc_9859_safety_management_manual_2.docx,366,aviation authority respect state safety programme implementation document avoid ambiguity appropriat...
icao_doc_9859_safety_management_manual_2.docx_20,icao_doc_9859_safety_management_manual_2.docx,371,safety performance discuss later chapter safety objective work together package enable state monitor...
icao_doc_9859_safety_management_manual_2.docx_21,icao_doc_9859_safety_management_manual_2.docx,361,aviation safety state produce national aviation safety plan state already state safety programme pla...
icao_doc_9859_safety_management_manual_2.docx_22,icao_doc_9859_safety_management_manual_2.docx,368,safety programme evolve mature initial state safety programme safety management system training limi...
icao_doc_9859_safety_management_manual_2.docx_23,icao_doc_9859_safety_management_manual_2.docx,381,aviation relate activity establish mean determine whether service provider safety risk management ac...
icao_doc_9859_safety_management_manual_2.docx_24,icao_doc_9859_safety_management_manual_2.docx,365,criterion operator implement safety management system establishment criterion require application sa...
icao_doc_9859_safety_management_manual_2.docx_25,icao_doc_9859_safety_management_manual_2.docx,391,authority demonstrate implementation performance acceptance methodology methods states evaluate proc...
icao_doc_9859_safety_management_manual_2.docx_26,icao_doc_9859_safety_management_manual_2.docx,359,regulatory authority role responsibility associate safety management system accountability framework...
icao_doc_9859_safety_management_manual_2.docx_27,icao_doc_9859_safety_management_manual_2.docx,373,base size maturity complexity aviation system state general guidance safety risk management process ...
icao_doc_9859_safety_management_manual_2.docx_28,icao_doc_9859_safety_management_manual_2.docx,375,analytical skill operational experience training experience variety hazard analysis technique hazard...
icao_doc_9859_safety_management_manual_2.docx_29,icao_doc_9859_safety_management_manual_2.docx,369,analysis sharing exchange mecha safety management system ensure regulatory safety risk control appro...
icao_doc_9859_safety_management_manual_2.docx_30,icao_doc_9859_safety_management_manual_2.docx,372,provider however improve greatly service provider organizational safety risk profile state wish deve...
icao_doc_9859_safety_management_manual_2.docx_31,icao_doc_9859_safety_management_manual_2.docx,359,monitoring measurement strategy include encompass area aviation system state responsible reflect out...
icao_doc_9859_safety_management_manual_2.docx_32,icao_doc_9859_safety_management_manual_2.docx,374,change safety issue arise process within state change periodic review state operational safety issue...
icao_doc_9859_safety_management_manual_2.docx_33,icao_doc_9859_safety_management_manual_2.docx,370,safety programme organizational change example reallocation responsibility restructure within state ...
icao_doc_9859_safety_management_manual_2.docx_34,icao_doc_9859_safety_management_manual_2.docx,366,improve aviation safety establish regulation implement change surveillance method also important com...
icao_doc_9859_safety_management_manual_2.docx_35,icao_doc_9859_safety_management_manual_2.docx,371,message target audience state safety programme document post website readily available personnel inf...
icao_doc_9859_safety_management_manual_2.docx_36,icao_doc_9859_safety_management_manual_2.docx,370,mechanism coordination state safety programme among organization internal review mechanism state wit...
icao_doc_9859_safety_management_manual_2.docx_37,icao_doc_9859_safety_management_manual_2.docx,368,assessment allow interaction number people different level organization determine effectiveness thro...
icao_doc_9859_safety_management_manual_2.docx_38,icao_doc_9859_safety_management_manual_2.docx,366,first component safety management system framework focus create environment safety management effect...
icao_doc_9859_safety_management_manual_2.docx_39,icao_doc_9859_safety_management_manual_2.docx,386,officer person ultimate authority safe operation organization accountable executive establishe promo...
icao_doc_9859_safety_management_manual_2.docx_40,icao_doc_9859_safety_management_manual_2.docx,385,define include make decision acceptability risk authority agree change implement authority assign in...
icao_doc_9859_safety_management_manual_2.docx_41,icao_doc_9859_safety_management_manual_2.docx,384,state authority necessary issue relate safety organization individual appoint safety manager dependi...
icao_doc_9859_safety_management_manual_2.docx_42,icao_doc_9859_safety_management_manual_2.docx,396,immediate action coordination emergency response planning refer planning activity take place within ...
icao_doc_9859_safety_management_manual_2.docx_43,icao_doc_9859_safety_management_manual_2.docx,386,process procedure safety investigation procedure procedure establish monitor safety performance indi...
icao_doc_9859_safety_management_manual_2.docx_44,icao_doc_9859_safety_management_manual_2.docx,366,provider safety investigation hazard identify internal safety investigation follow report accident i...
icao_doc_9859_safety_management_manual_2.docx_45,icao_doc_9859_safety_management_manual_2.docx,365,challenge taxonomy appropriate degree detail specific enough hazard easy allocate generic enough haz...
icao_doc_9859_safety_management_manual_2.docx_46,icao_doc_9859_safety_management_manual_2.docx,364,investigate great depth low risk potential service provider structure decision make approach define ...
icao_doc_9859_safety_management_manual_2.docx_47,icao_doc_9859_safety_management_manual_2.docx,369,safety risk assessment criterion likely occur improbable assign identify safety risk quantitative av...
icao_doc_9859_safety_management_manual_2.docx_48,icao_doc_9859_safety_management_manual_2.docx,378,management system identify area potential improvement aviation safety regulation generic safety risk...
icao_doc_9859_safety_management_manual_2.docx_49,icao_doc_9859_safety_management_manual_2.docx,365,performance monitoring measurement conduct observe basic principle safety performance achieve indica...
icao_doc_9859_safety_management_manual_2.docx_50,icao_doc_9859_safety_management_manual_2.docx,394,safety information analyse collect safety operational collection system flight analysis information ...
icao_doc_9859_safety_management_manual_2.docx_51,icao_doc_9859_safety_management_manual_2.docx,373,hazards safety risk control affect change also review step exist organization safety risk management...
icao_doc_9859_safety_management_manual_2.docx_52,icao_doc_9859_safety_management_manual_2.docx,375,provider establish implement process procedure facilitate effective communication throughout level o...
icao_doc_9859_safety_management_manual_2.docx_53,icao_doc_9859_safety_management_manual_2.docx,367,depend involvement safety management system people work organization direct indirect relationship av...
icao_doc_9859_safety_management_manual_2.docx_54,icao_doc_9859_safety_management_manual_2.docx,413,understand safety critical information distribute do part internal audit activity assess safety mana...
icao_doc_9859_safety_management_manual_2.docx_55,icao_doc_9859_safety_management_manual_2.docx,386,area impact safety decision impact internal resource investment agreement contract external organiza...
icao_doc_9859_safety_management_manual_2.docx_56,icao_doc_9859_safety_management_manual_2.docx,401,activity small organization involve activity entail significant aviation safety risk therefore safet...
icao_doc_9859_safety_management_manual_2.docx_57,icao_doc_9859_safety_management_manual_2.docx,382,prevent integration different regulator standard body diverge expectation requirement integrate diff...
icao_doc_9859_safety_management_manual_2.docx_58,icao_doc_9859_safety_management_manual_2.docx,172,service provider already safety management system function place development safety management syste...
investigating_human_error_aircraft_accidents_10.docx_0,investigating_human_error_aircraft_accidents_10.docx,392,title investigate human incidents accidents complex systems chapter author barry rauch category safe...
investigating_human_error_aircraft_accidents_10.docx_1,investigating_human_error_aircraft_accidents_10.docx,381,identify determine effect antecedent associate operator team make effective teams leadership effecti...
investigating_human_error_aircraft_accidents_10.docx_2,investigating_human_error_aircraft_accidents_10.docx,398,achievement strive dependability assume write team member possess personality facet effective specif...
investigating_human_error_aircraft_accidents_10.docx_3,investigating_human_error_aircraft_accidents_10.docx,375,examine type team breakdown describe error communication coordination cooperation lead error team co...
investigating_human_error_aircraft_accidents_10.docx_4,investigating_human_error_aircraft_accidents_10.docx,377,investigation branch minute takeoff pilot feel investigator term moderate severe vibration smell fir...
investigating_human_error_aircraft_accidents_10.docx_5,investigating_human_error_aircraft_accidents_10.docx,410,crewmember become distracted commit error exacerbate severity situation everglade accident pilot sim...
investigating_human_error_aircraft_accidents_10.docx_6,investigating_human_error_aircraft_accidents_10.docx,387,operator team influence antecedent operator performance single operator operator team system compara...
investigating_human_error_aircraft_accidents_10.docx_7,investigating_human_error_aircraft_accidents_10.docx,370,although captain remain command throughout flight generally alternate duty pilot fly pilot fly tsch ...
investigating_human_error_aircraft_accidents_10.docx_8,investigating_human_error_aircraft_accidents_10.docx,380,resource management program address leadership quality critical element successful interaction super...
investigating_human_error_aircraft_accidents_10.docx_9,investigating_human_error_aircraft_accidents_10.docx,388,traffic controller give taxi clearance active runway although type airplane captain steer airplane t...
investigating_human_error_aircraft_accidents_10.docx_10,investigating_human_error_aircraft_accidents_10.docx,397,likely commit error determine number task operator attempt perform amount time available perform tas...
investigating_human_error_aircraft_accidents_10.docx_11,investigating_human_error_aircraft_accidents_10.docx,383,pilot controller electronically transmit voice communication among controller marine vessel traffic ...
investigating_human_error_aircraft_accidents_10.docx_12,investigating_human_error_aircraft_accidents_10.docx,370,accident investigation example government agency company approach light system place security camera...
investigating_human_error_aircraft_accidents_10.docx_13,investigating_human_error_aircraft_accidents_10.docx,359,determine whether complete require task sequence perform task information particularly helpful inves...
investigating_human_error_aircraft_accidents_10.docx_14,investigating_human_error_aircraft_accidents_10.docx,385,engine boeing engine close ground reverse thrust terminal could redirect debris front engine damage ...
investigating_human_error_aircraft_accidents_10.docx_15,investigating_human_error_aircraft_accidents_10.docx,379,pilot omit critical step landing checklist call pilot engage hydraulic system mechanism power flap l...
investigating_human_error_aircraft_accidents_10.docx_16,investigating_human_error_aircraft_accidents_10.docx,392,airplane stall acceptable speed safe flight become speed contamination integrating information multi...
investigating_human_error_aircraft_accidents_10.docx_17,investigating_human_error_aircraft_accidents_10.docx,69,local time universal coordinated time also refer greenwich mean time examine derive multiple recorde...
investigating_human_error_aircraft_accidents_2.docx_0,investigating_human_error_aircraft_accidents_2.docx,387,title investigate human incidents accidents complex systems chapter author barry rauch category safe...
investigating_human_error_aircraft_accidents_2.docx_1,investigating_human_error_aircraft_accidents_2.docx,365,organization regulator explain proximate error close accident term time location underlie condition ...
investigating_human_error_aircraft_accidents_2.docx_2,investigating_human_error_aircraft_accidents_2.docx,376,recently broad perspective spaceship designer manufacturer scaled composites consider single could l...
investigating_human_error_aircraft_accidents_2.docx_3,investigating_human_error_aircraft_accidents_2.docx,364,factor rather technical operational issue dominate risk hazardous industry large majority accident i...
investigating_human_error_aircraft_accidents_2.docx_4,investigating_human_error_aircraft_accidents_2.docx,376,coherent accurate evidence base account disaster occur make recommendation prevent recurrence traged...
investigating_human_error_aircraft_accidents_2.docx_5,investigating_human_error_aircraft_accidents_2.docx,366,node version simply inaccurate perfectly acceptable account moral clear causal feature accident anal...
investigating_human_error_aircraft_accidents_2.docx_6,investigating_human_error_aircraft_accidents_2.docx,372,frequently year example accident use case study chapter current complex error true case study first ...
investigating_human_error_aircraft_accidents_2.docx_7,investigating_human_error_aircraft_accidents_2.docx,379,reduce likelihood future finally dedicated memory howard brandon whose father colleague mentor frien...
investigating_human_error_aircraft_accidents_2.docx_8,investigating_human_error_aircraft_accidents_2.docx,371,still formative stage evan byrne bart elias national transportation safety board provide beneficial ...
investigating_human_error_aircraft_accidents_2.docx_9,investigating_human_error_aircraft_accidents_2.docx,365,anticipate address potential opportunity hope prevent error commit jeopardize system safety crash fl...
investigating_human_error_aircraft_accidents_2.docx_10,investigating_human_error_aircraft_accidents_2.docx,358,hazardous airline prohibit load expend unprotected canister oxygen generator aircraft accident clear...
investigating_human_error_aircraft_accidents_2.docx_11,investigating_human_error_aircraft_accidents_2.docx,393,participate investigation please consider example present tool illustrate point make reflection susc...
investigating_human_error_aircraft_accidents_2.docx_12,investigating_human_error_aircraft_accidents_2.docx,381,recorder use different system examine contribution tiga tion system discuss recent accident present ...
investigating_human_error_aircraft_accidents_2.docx_13,investigating_human_error_aircraft_accidents_2.docx,377,douglas craft design year could carry passenger speed mile hour several hundred mile today pilot als...
investigating_human_error_aircraft_accidents_2.docx_14,investigating_human_error_aircraft_accidents_2.docx,380,operational phase system relate information perceive potential severity consequence complex system o...
investigating_human_error_aircraft_accidents_2.docx_15,investigating_human_error_aircraft_accidents_2.docx,400,safety complex system senders moray reason suggest impossibility eliminate operator recognize focus ...
investigating_human_error_aircraft_accidents_2.docx_16,investigating_human_error_aircraft_accidents_2.docx,382,incident accident form triangle pyramid injury incident occur least often locate bottom pyramid inci...
investigating_human_error_aircraft_accidents_2.docx_17,investigating_human_error_aircraft_accidents_2.docx,383,step attempt complete task reason also distinguish mistake violation error intent mistake result ina...
investigating_human_error_aircraft_accidents_2.docx_18,investigating_human_error_aircraft_accidents_2.docx,378,directly accident incident examination human action decision manager designer blunt least much actio...
investigating_human_error_aircraft_accidents_2.docx_19,investigating_human_error_aircraft_accidents_2.docx,389,tend action error error interpretation navigation understanding mean multiple alarm tend decision er...
investigating_human_error_aircraft_accidents_2.docx_20,investigating_human_error_aircraft_accidents_2.docx,366,understand machine design lead process accidents today researcher devote considerable attention exam...
investigating_human_error_aircraft_accidents_2.docx_21,investigating_human_error_aircraft_accidents_2.docx,350,organization define aircraft accident occurrence associate operation aircraft take place time person...
investigating_human_error_aircraft_accidents_2.docx_22,investigating_human_error_aircraft_accidents_2.docx,360,sophisticated understanding accident causation aviation accident investigation pilot operator long s...
investigating_human_error_aircraft_accidents_2.docx_23,investigating_human_error_aircraft_accidents_2.docx,358,accident investigation epistemological establish happen preventive identify path way avoidance moral...
investigating_human_error_aircraft_accidents_2.docx_24,investigating_human_error_aircraft_accidents_2.docx,377,eliminate opportunity reduce although first assumption rather obvious assume contrary add step opera...
investigating_human_error_aircraft_accidents_2.docx_25,investigating_human_error_aircraft_accidents_2.docx,408,benefit model also practical still adhere research finding causation eschew model favor method base ...
investigating_human_error_aircraft_accidents_2.docx_26,investigating_human_error_aircraft_accidents_2.docx,47,cause event moray delineate system element lead complex system investigation many objective purpose ...
investigating_human_error_aircraft_accidents_4.docx_0,investigating_human_error_aircraft_accidents_4.docx,363,title investigate human incidents accidents complex systems chapter author barry rauch category safe...
investigating_human_error_aircraft_accidents_4.docx_1,investigating_human_error_aircraft_accidents_4.docx,369,obtain many measure continuously collect throughout event unlike researcher generally collect parame...
investigating_human_error_aircraft_accidents_4.docx_2,investigating_human_error_aircraft_accidents_4.docx,366,hazard accident first place however could accept engineer explanation likely cause accident investig...
investigating_human_error_aircraft_accidents_4.docx_3,investigating_human_error_aircraft_accidents_4.docx,357,determine defect cause accident internally consistent reveal effect defect among variety type except...
investigating_human_error_aircraft_accidents_4.docx_4,investigating_human_error_aircraft_accidents_4.docx,381,power reduction first brake application corresponding order expect operator action also match passag...
investigating_human_error_aircraft_accidents_4.docx_5,investigating_human_error_aircraft_accidents_4.docx,366,event whether airplane accident chemical refinery explosion vessel ground stop collect analyze point...
investigating_human_error_aircraft_accidents_4.docx_6,investigating_human_error_aircraft_accidents_4.docx,407,several additional factor would long consider relevant accident example test find acceptable conditi...
investigating_human_error_aircraft_accidents_4.docx_7,investigating_human_error_aircraft_accidents_4.docx,371,relate relationship meet criterion likely other influence antecedent variable simple possible direct...
investigating_human_error_aircraft_accidents_4.docx_8,investigating_human_error_aircraft_accidents_4.docx,390,pattern schedule change disrupt sleep pattern cause sleep deficit accident occur time would ordinari...
investigating_human_error_aircraft_accidents_4.docx_9,investigating_human_error_aircraft_accidents_4.docx,360,identify influence obtain result researcher strive control variable could identify unidentified vari...
investigating_human_error_aircraft_accidents_4.docx_10,investigating_human_error_aircraft_accidents_4.docx,351,recommendation begin explanation deficiency adverse effect safety refer deficiency ante dent error d...
investigating_human_error_aircraft_accidents_4.docx_11,investigating_human_error_aircraft_accidents_4.docx,380,antecedent error human investigator usually collect substantial amount however internally sequential...
investigating_human_error_aircraft_accidents_4.docx_12,investigating_human_error_aircraft_accidents_4.docx,396,aerodynamic stall present information different sensory modality unique advantage disadvantage term ...
investigating_human_error_aircraft_accidents_4.docx_13,investigating_human_error_aircraft_accidents_4.docx,386,present aircraft engine information considerably interpret able current display information presenta...
investigating_human_error_aircraft_accidents_4.docx_14,investigating_human_error_aircraft_accidents_4.docx,381,rapidly communicate critical form tion operator patterson worth oxley dennis however aurally present...
investigating_human_error_aircraft_accidents_4.docx_15,investigating_human_error_aircraft_accidents_4.docx,400,engineer ger investigator conclude aural alert would inform freight locomotive engineer brakeman imp...
investigating_human_error_aircraft_accidents_4.docx_16,investigating_human_error_aircraft_accidents_4.docx,386,inoperative static system pilot unable determine cause alert important operating night water could v...
investigating_human_error_aircraft_accidents_4.docx_17,investigating_human_error_aircraft_accidents_4.docx,383,maintain select speed control windshield wiper speed headlight brightness sound horn engage turn sig...
investigating_human_error_aircraft_accidents_4.docx_18,investigating_human_error_aircraft_accidents_4.docx,387,regard descent rate engage pilot aware fail notice rapid descent ground shape controls take number f...
investigating_human_error_aircraft_accidents_4.docx_19,investigating_human_error_aircraft_accidents_4.docx,390,location control aircraft investigator conclude pilot operate aircraft would inadvertently reach sel...
investigating_human_error_aircraft_accidents_4.docx_20,investigating_human_error_aircraft_accidents_4.docx,143,difference equipment excessively damage result event interview designer obtain information philosoph...
investigating_human_error_aircraft_accidents_6.docx_0,investigating_human_error_aircraft_accidents_6.docx,382,title investigate human incidents accidents complex systems chapter author barry rauch category safe...
investigating_human_error_aircraft_accidents_6.docx_1,investigating_human_error_aircraft_accidents_6.docx,359,evidently impair without realize adverse effect subtle impairment illness performance safety researc...
investigating_human_error_aircraft_accidents_6.docx_2,investigating_human_error_aircraft_accidents_6.docx,360,carry generalize warning label hazard drive operate heavy machinery warning often write small font m...
investigating_human_error_aircraft_accidents_6.docx_3,investigating_human_error_aircraft_accidents_6.docx,360,degradation crave drug post cocaine induce fatigue finding demonstrate hour someone consume drug dru...
investigating_human_error_aircraft_accidents_6.docx_4,investigating_human_error_aircraft_accidents_6.docx,376,require form supervisor medical condition despite impairment continue serve train operator depend co...
investigating_human_error_aircraft_accidents_6.docx_5,investigating_human_error_aircraft_accidents_6.docx,382,state characterize impair performance alertness fatigue impair information processing reaction time ...
investigating_human_error_aircraft_accidents_6.docx_6,investigating_human_error_aircraft_accidents_6.docx,397,schedule rapid body ability adjust experience know circadian synchro popularly refer circadian synch...
investigating_human_error_aircraft_accidents_6.docx_7,investigating_human_error_aircraft_accidents_6.docx,375,antecedent ation regulator relate antecedent medical condition oper aware report company regulator r...
investigating_human_error_aircraft_accidents_6.docx_8,investigating_human_error_aircraft_accidents_6.docx,379,price highlight importance document sleep quality operator accrue sufficient sleep around hour regul...
investigating_human_error_aircraft_accidents_6.docx_9,investigating_human_error_aircraft_accidents_6.docx,372,circadian disruption example shift shift night shift operator likely fatigue immediate night follow ...
investigating_human_error_aircraft_accidents_6.docx_10,investigating_human_error_aircraft_accidents_6.docx,366,marital problem major career decision relationship difficulty relate problem impend marriage recent ...
investigating_human_error_aircraft_accidents_6.docx_11,investigating_human_error_aircraft_accidents_6.docx,387,computer report duty dent first officer fly home west coast united states newark change plane memphi...
investigating_human_error_aircraft_accidents_6.docx_12,investigating_human_error_aircraft_accidents_6.docx,398,conditions review operator medical record company maintain maintain personal health care provider he...
investigating_human_error_aircraft_accidents_6.docx_13,investigating_human_error_aircraft_accidents_6.docx,408,interview family colleague determine whether operator experience stress event react company japanese...
investigating_human_error_aircraft_accidents_6.docx_14,investigating_human_error_aircraft_accidents_6.docx,404,individual team performance system safety paris cannon bower believe insufficient number operator cr...
