Chunk ID,Filename,Tokens,Text
2025-02-28_Regulation_14CFR_SafetyManagement_v1.docx_0,2025-02-28_Regulation_14CFR_SafetyManagement_v1.docx,407,title code federal regulation part safety management systems author federal aviation administration ...
2025-02-28_Regulation_14CFR_SafetyManagement_v1.docx_1,2025-02-28_Regulation_14CFR_SafetyManagement_v1.docx,431,safety objective account ability responsibility employee regard safety safety promotion mean combina...
2025-02-28_Regulation_14CFR_SafetyManagement_v1.docx_2,2025-02-28_Regulation_14CFR_SafetyManagement_v1.docx,410,management system meet requirement part implement safety management system accordance part later may...
2025-02-28_Regulation_14CFR_SafetyManagement_v1.docx_3,2025-02-28_Regulation_14CFR_SafetyManagement_v1.docx,377,aviation product service operating environment personnel equipment facility necessary operation impl...
2025-02-28_Regulation_14CFR_SafetyManagement_v1.docx_4,2025-02-28_Regulation_14CFR_SafetyManagement_v1.docx,401,hazard identification safety risk analysis monitor effectiveness safety risk control ensure safety p...
2025-02-28_Regulation_14CFR_SafetyManagement_v1.docx_5,2025-02-28_Regulation_14CFR_SafetyManagement_v1.docx,302,person require safety management system part must develop maintain process analyze datum acquire pro...
